{
  "analysis_schema_version": 1,
  "group_by": [
    "network.latency_steps",
    "network.packet_loss_rate",
    "protocol.name"
  ],
  "method": {
    "assumptions": [
      "Runs within a group differ only in independent replicate seeds.",
      "The sample mean is an appropriate estimand for the selected metric.",
      "For small n, the sampling distribution is approximately normal."
    ],
    "confidence": 0.95,
    "excluded": [
      "failed runs",
      "runtime_seconds"
    ],
    "name": "two-sided Student-t confidence interval",
    "replicate_unit": "seed"
  },
  "metrics": [
    "resolution_probability",
    "risks_unresolved",
    "modeled_maneuver_cost",
    "messages_sent",
    "messages_dropped",
    "decision_deadline_misses",
    "auction_successes"
  ],
  "rows": [
    {
      "ci95_high": 0.2,
      "ci95_low": 0.2,
      "mean": 0.2,
      "metric": "resolution_probability",
      "n": 3,
      "network.latency_steps": 0,
      "network.packet_loss_rate": 0.0,
      "protocol.name": "auction",
      "sample_sd": 0.0,
      "seed_count": 3,
      "standard_error": 0.0
    },
    {
      "ci95_high": 0.0,
      "ci95_low": 0.0,
      "mean": 0.0,
      "metric": "risks_unresolved",
      "n": 3,
      "network.latency_steps": 0,
      "network.packet_loss_rate": 0.0,
      "protocol.name": "auction",
      "sample_sd": 0.0,
      "seed_count": 3,
      "standard_error": 0.0
    },
    {
      "ci95_high": 80.0,
      "ci95_low": 80.0,
      "mean": 80.0,
      "metric": "modeled_maneuver_cost",
      "n": 3,
      "network.latency_steps": 0,
      "network.packet_loss_rate": 0.0,
      "protocol.name": "auction",
      "sample_sd": 0.0,
      "seed_count": 3,
      "standard_error": 0.0
    },
    {
      "ci95_high": 27.0,
      "ci95_low": 27.0,
      "mean": 27.0,
      "metric": "messages_sent",
      "n": 3,
      "network.latency_steps": 0,
      "network.packet_loss_rate": 0.0,
      "protocol.name": "auction",
      "sample_sd": 0.0,
      "seed_count": 3,
      "standard_error": 0.0
    },
    {
      "ci95_high": 0.0,
      "ci95_low": 0.0,
      "mean": 0.0,
      "metric": "messages_dropped",
      "n": 3,
      "network.latency_steps": 0,
      "network.packet_loss_rate": 0.0,
      "protocol.name": "auction",
      "sample_sd": 0.0,
      "seed_count": 3,
      "standard_error": 0.0
    },
    {
      "ci95_high": 0.0,
      "ci95_low": 0.0,
      "mean": 0.0,
      "metric": "decision_deadline_misses",
      "n": 3,
      "network.latency_steps": 0,
      "network.packet_loss_rate": 0.0,
      "protocol.name": "auction",
      "sample_sd": 0.0,
      "seed_count": 3,
      "standard_error": 0.0
    },
    {
      "ci95_high": 1.0,
      "ci95_low": 1.0,
      "mean": 1.0,
      "metric": "auction_successes",
      "n": 3,
      "network.latency_steps": 0,
      "network.packet_loss_rate": 0.0,
      "protocol.name": "auction",
      "sample_sd": 0.0,
      "seed_count": 3,
      "standard_error": 0.0
    },
    {
      "ci95_high": 1.0,
      "ci95_low": 1.0,
      "mean": 1.0,
      "metric": "resolution_probability",
      "n": 3,
      "network.latency_steps": 0,
      "network.packet_loss_rate": 0.0,
      "protocol.name": "centralized",
      "sample_sd": 0.0,
      "seed_count": 3,
      "standard_error": 0.0
    },
    {
      "ci95_high": 0.0,
      "ci95_low": 0.0,
      "mean": 0.0,
      "metric": "risks_unresolved",
      "n": 3,
      "network.latency_steps": 0,
      "network.packet_loss_rate": 0.0,
      "protocol.name": "centralized",
      "sample_sd": 0.0,
      "seed_count": 3,
      "standard_error": 0.0
    },
    {
      "ci95_high": 320.0,
      "ci95_low": 320.0,
      "mean": 320.0,
      "metric": "modeled_maneuver_cost",
      "n": 3,
      "network.latency_steps": 0,
      "network.packet_loss_rate": 0.0,
      "protocol.name": "centralized",
      "sample_sd": 0.0,
      "seed_count": 3,
      "standard_error": 0.0
    },
    {
      "ci95_high": 8.0,
      "ci95_low": 8.0,
      "mean": 8.0,
      "metric": "messages_sent",
      "n": 3,
      "network.latency_steps": 0,
      "network.packet_loss_rate": 0.0,
      "protocol.name": "centralized",
      "sample_sd": 0.0,
      "seed_count": 3,
      "standard_error": 0.0
    },
    {
      "ci95_high": 0.0,
      "ci95_low": 0.0,
      "mean": 0.0,
      "metric": "messages_dropped",
      "n": 3,
      "network.latency_steps": 0,
      "network.packet_loss_rate": 0.0,
      "protocol.name": "centralized",
      "sample_sd": 0.0,
      "seed_count": 3,
      "standard_error": 0.0
    },
    {
      "ci95_high": 0.0,
      "ci95_low": 0.0,
      "mean": 0.0,
      "metric": "decision_deadline_misses",
      "n": 3,
      "network.latency_steps": 0,
      "network.packet_loss_rate": 0.0,
      "protocol.name": "centralized",
      "sample_sd": 0.0,
      "seed_count": 3,
      "standard_error": 0.0
    },
    {
      "ci95_high": 0.0,
      "ci95_low": 0.0,
      "mean": 0.0,
      "metric": "auction_successes",
      "n": 3,
      "network.latency_steps": 0,
      "network.packet_loss_rate": 0.0,
      "protocol.name": "centralized",
      "sample_sd": 0.0,
      "seed_count": 3,
      "standard_error": 0.0
    },
    {
      "ci95_high": 1.0,
      "ci95_low": 1.0,
      "mean": 1.0,
      "metric": "resolution_probability",
      "n": 3,
      "network.latency_steps": 0,
      "network.packet_loss_rate": 0.0,
      "protocol.name": "greedy",
      "sample_sd": 0.0,
      "seed_count": 3,
      "standard_error": 0.0
    },
    {
      "ci95_high": 0.0,
      "ci95_low": 0.0,
      "mean": 0.0,
      "metric": "risks_unresolved",
      "n": 3,
      "network.latency_steps": 0,
      "network.packet_loss_rate": 0.0,
      "protocol.name": "greedy",
      "sample_sd": 0.0,
      "seed_count": 3,
      "standard_error": 0.0
    },
    {
      "ci95_high": 320.0,
      "ci95_low": 320.0,
      "mean": 320.0,
      "metric": "modeled_maneuver_cost",
      "n": 3,
      "network.latency_steps": 0,
      "network.packet_loss_rate": 0.0,
      "protocol.name": "greedy",
      "sample_sd": 0.0,
      "seed_count": 3,
      "standard_error": 0.0
    },
    {
      "ci95_high": 8.0,
      "ci95_low": 8.0,
      "mean": 8.0,
      "metric": "messages_sent",
      "n": 3,
      "network.latency_steps": 0,
      "network.packet_loss_rate": 0.0,
      "protocol.name": "greedy",
      "sample_sd": 0.0,
      "seed_count": 3,
      "standard_error": 0.0
    },
    {
      "ci95_high": 0.0,
      "ci95_low": 0.0,
      "mean": 0.0,
      "metric": "messages_dropped",
      "n": 3,
      "network.latency_steps": 0,
      "network.packet_loss_rate": 0.0,
      "protocol.name": "greedy",
      "sample_sd": 0.0,
      "seed_count": 3,
      "standard_error": 0.0
    },
    {
      "ci95_high": 0.0,
      "ci95_low": 0.0,
      "mean": 0.0,
      "metric": "decision_deadline_misses",
      "n": 3,
      "network.latency_steps": 0,
      "network.packet_loss_rate": 0.0,
      "protocol.name": "greedy",
      "sample_sd": 0.0,
      "seed_count": 3,
      "standard_error": 0.0
    },
    {
      "ci95_high": 0.0,
      "ci95_low": 0.0,
      "mean": 0.0,
      "metric": "auction_successes",
      "n": 3,
      "network.latency_steps": 0,
      "network.packet_loss_rate": 0.0,
      "protocol.name": "greedy",
      "sample_sd": 0.0,
      "seed_count": 3,
      "standard_error": 0.0
    },
    {
      "ci95_high": 0.35353333333333337,
      "ci95_low": -0.22020000000000006,
      "mean": 0.06666666666666667,
      "metric": "resolution_probability",
      "n": 3,
      "network.latency_steps": 0,
      "network.packet_loss_rate": 0.3,
      "protocol.name": "auction",
      "sample_sd": 0.11547005383792516,
      "seed_count": 3,
      "standard_error": 0.06666666666666668
    },
    {
      "ci95_high": 2.101,
      "ci95_low": -0.7676666666666666,
      "mean": 0.6666666666666666,
      "metric": "risks_unresolved",
      "n": 3,
      "network.latency_steps": 0,
      "network.packet_loss_rate": 0.3,
      "protocol.name": "auction",
      "sample_sd": 0.5773502691896257,
      "seed_count": 3,
      "standard_error": 0.3333333333333333
    },
    {
      "ci95_high": 141.41333333333333,
      "ci95_low": -88.08,
      "mean": 26.666666666666668,
      "metric": "modeled_maneuver_cost",
      "n": 3,
      "network.latency_steps": 0,
      "network.packet_loss_rate": 0.3,
      "protocol.name": "auction",
      "sample_sd": 46.18802153517006,
      "seed_count": 3,
      "standard_error": 26.666666666666668
    },
    {
      "ci95_high": 34.91481759140554,
      "ci95_low": -0.9148175914055372,
      "mean": 17.0,
      "metric": "messages_sent",
      "n": 3,
      "network.latency_steps": 0,
      "network.packet_loss_rate": 0.3,
      "protocol.name": "auction",
      "sample_sd": 7.211102550927978,
      "seed_count": 3,
      "standard_error": 4.163331998932265
    },
    {
      "ci95_high": 9.48433820832296,
      "ci95_low": 4.51566179167704,
      "mean": 7.0,
      "metric": "messages_dropped",
      "n": 3,
      "network.latency_steps": 0,
      "network.packet_loss_rate": 0.3,
      "protocol.name": "auction",
      "sample_sd": 1.0,
      "seed_count": 3,
      "standard_error": 0.5773502691896258
    },
    {
      "ci95_high": 2.101,
      "ci95_low": -0.7676666666666666,
      "mean": 0.6666666666666666,
      "metric": "decision_deadline_misses",
      "n": 3,
      "network.latency_steps": 0,
      "network.packet_loss_rate": 0.3,
      "protocol.name": "auction",
      "sample_sd": 0.5773502691896257,
      "seed_count": 3,
      "standard_error": 0.3333333333333333
    },
    {
      "ci95_high": 1.7676666666666665,
      "ci95_low": -1.101,
      "mean": 0.3333333333333333,
      "metric": "auction_successes",
      "n": 3,
      "network.latency_steps": 0,
      "network.packet_loss_rate": 0.3,
      "protocol.name": "auction",
      "sample_sd": 0.5773502691896257,
      "seed_count": 3,